{
  "$schema": "https://specdev.local/schema/13_scaffold.schema.json",
  "id": "scaffold-core",
  "owner": "api",
  "created_at": "2025-10-17T00:00:00Z",
  "service_skeleton": {
    "language": "python",
    "framework": "fastapi",
    "modules": [
      "auth",
      "routes",
      "validators"
    ]
  },
  "route_map": [
    {
      "api_ref": "api-login",
      "path": "/v1/login",
      "method": "POST"
    }
  ],
  "validators": [
    "validate-request-schema",
    "enforce-invariants"
  ],
  "build_status": "pending"
}
